{
  "id": "T13.1",
  "milestone_id": "M13",
  "title": "Create subsystem registry for auth",
  "domain": "Shared",
  "capability": "Knowledge Registry",
  "purpose": "Register the auth subsystem with ownership, dependencies, criticality, and lifecycle state.",
  "dependencies": [
    "T11.3"
  ],
  "architectural_constraints": [
    "Must reference existing code, not create new",
    "Must identify owner (human or team)",
    "Must classify criticality"
  ],
  "deliverables": [
    {
      "path": "meta/registry/auth.json",
      "description": "Auth subsystem registry entry",
      "type": "file"
    }
  ],
  "acceptance_criteria": [
    "Auth registry entry has owner field",
    "Auth registry entry lists all dependencies",
    "Auth criticality classified (critical | important | normal)",
    "Auth lifecycle state documented"
  ],
  "estimated_hours": 1,
  "status": "planned"
}
